{
  "api_version": "kdlc.dev/release-evaluation-profile/v1alpha1",
  "id": "kdlc-mvp-pre-release",
  "version": 1,
  "corpus": {
    "id": "kdlc-mvp-recorded",
    "version": 1,
    "sha256": "sha256:ed593716099076851352f9915d6769e66f7f2611db87152e0eac2f75f243e64f"
  },
  "mandatory_requirements": ["FEAT-001", "FEAT-002", "FEAT-003", "FEAT-004", "FEAT-005", "FEAT-006", "FEAT-008", "FEAT-009"],
  "mode": "recorded-only",
  "structural_thresholds": {
    "minimum_pass_rate": 1,
    "security_failures_allowed": 0,
    "live_model_calls_allowed": 0
  },
  "statistical_suite": {
    "status": "pending",
    "required_trials": 30,
    "confidence": 0.95,
    "reason": "A reviewed multi-trial model-quality corpus and confidence-interval report remain required before release."
  }
}
